one,two,index,text,raw_text,start_time,end_time,speaker_id,speaker_name
8,38,38,This question is kind of related to the question I just asked.,This question is kind of related to the question I just asked.,241.36,244.394,0,JM
8,39,39,"If you could change one thing about either Vex or your Stem implementation, what would make your life easier as an educator, what could we provide for you that could really make what you're doing with them a lot easier than what you are currently doing right now?","If you could change one thing about either Vex or your Stem implementation, what would make your life easier as an educator, what could we provide for you that could really make what you're doing with them a lot easier than what you are currently doing right now?",244.512,261.102,0,JM
8,40,40,"Let us know that, please.","Let us know that, please.",261.236,262.59,0,JM
8,41,41,We would love to be able to provide that for you.,We would love to be able to provide that for you.,262.66,264.96,0,JM
8,42,42,"I do think that your conference, your educators conference, should be more about what can we do, what can we take back to our classroom?","I do think that your conference, your educators conference, should be more about what can we do, what can we take back to our classroom?",267.03,279.11,1,Dallas Librarian
8,43,43,So we are not most of the people that are attending here are classroom teachers.,So we are not most of the people that are attending here are classroom teachers.,279.69,286.482,1,Dallas Librarian
8,44,44,We're not principals.,We're not principals.,286.626,288.15,1,Dallas Librarian
8,45,45,"We're not over our Steam department, and we're not superintendent.","We're not over our Steam department, and we're not superintendent.",288.51,293.13,1,Dallas Librarian
8,46,46,"So while hearing from Chicago and Miami Dade about the programs they have and how they've implemented them, that doesn't help me as an educator.","So while hearing from Chicago and Miami Dade about the programs they have and how they've implemented them, that doesn't help me as an educator.",293.47,306.43,1,Dallas Librarian
8,47,47,Take that back to my classroom.,Take that back to my classroom.,307.17,310.43,1,Dallas Librarian
8,48,48,"It's interesting, and it's good to know.","It's interesting, and it's good to know.",310.77,313.522,1,Dallas Librarian
8,49,49,"And there are some resources that the AI guy provided, so I've taken some of that, and then the few other resource is I'm looking over my notes.","And there are some resources that the AI guy provided, so I've taken some of that, and then the few other resource is I'm looking over my notes.",313.656,335.042,1,Dallas Librarian
8,50,50,"But that's basically what I am looking for, is also, in addition, grants.","But that's basically what I am looking for, is also, in addition, grants.",335.106,342.662,1,Dallas Librarian
8,51,51,What grants are available that we can apply for so that we can fund some of these?,What grants are available that we can apply for so that we can fund some of these?,342.726,350.246,1,Dallas Librarian
8,52,52,As someone who works in Dallas ISD it's a huge district.,As someone who works in Dallas ISD it's a huge district.,350.368,355.39,1,Dallas Librarian
8,53,53,"As a single educator, I can only influence my particular school.","As a single educator, I can only influence my particular school.",355.73,360.606,1,Dallas Librarian
8,54,54,"So what grants are available that you know of, whether they're federal or in the state or in the computer science area that I could apply for to get more excess money funds to purchase more of the Mexico?","So what grants are available that you know of, whether they're federal or in the state or in the computer science area that I could apply for to get more excess money funds to purchase more of the Mexico?",360.708,380.29,1,Dallas Librarian
8,55,55,"All right, thank you for your information.","All right, thank you for your information.",382.49,384.038,0,JM
8,56,56,That's wonderful.,That's wonderful.,384.124,385.026,0,JM
8,57,57,"Is there anything else that you want to share with us, anything that you want to share with us that you think, again, would be valuable feedback that we can take with us back to our offices?","Is there anything else that you want to share with us, anything that you want to share with us that you think, again, would be valuable feedback that we can take with us back to our offices?",385.138,395.366,0,JM
8,58,58,"And again, use your feedback to make any of our platforms or Vex Two and VR or Vex professionals on the club that much better for you.","And again, use your feedback to make any of our platforms or Vex Two and VR or Vex professionals on the club that much better for you.",395.398,403.274,0,JM
8,59,59,So take this question again to just wax poetic about anything that you would like.,So take this question again to just wax poetic about anything that you would like.,403.312,407.934,0,JM
8,60,60,Be honest with us.,Be honest with us.,408.052,408.974,0,JM
8,61,61,Be really honest.,Be really honest.,409.012,409.886,0,JM
8,62,62,Don't be afraid to tell us that something that we have is terrible.,Don't be afraid to tell us that something that we have is terrible.,409.988,412.538,0,JM
8,63,63,Be honest with us and let us know what it is that we can do.,Be honest with us and let us know what it is that we can do.,412.634,416.9,0,JM
8,64,64,"Or if there is something that you really love, you can let us know.","Or if there is something that you really love, you can let us know.",417.27,420.386,0,JM
8,65,65,"That also, I think you've done an excellent job of inspiring us as educators to invest in Vex Robots.","That also, I think you've done an excellent job of inspiring us as educators to invest in Vex Robots.",420.408,433.73,1,Dallas Librarian
8,66,66,"And the kits that you have, they are engaging, from what we can see, and just more information about your product, more ways about how we can engage our students, specifically in the classroom, and would love to know more about the Vex code VR that is also available and the coding there.","And the kits that you have, they are engaging, from what we can see, and just more information about your product, more ways about how we can engage our students, specifically in the classroom, and would love to know more about the Vex code VR that is also available and the coding there.",433.81,459.52,1,Dallas Librarian
8,67,67,One of my favorite parts about this job is I get to travel the world and talk to educators all the time.,One of my favorite parts about this job is I get to travel the world and talk to educators all the time.,462.85,468.482,0,JM
8,68,68,"And I love hearing about the success stories with Vex Robotics, whether that's a parent talking about how their student now is so much more engaged in school as a result of Vex, or a student talking about how much they love engineering now, how much they love computer science.","And I love hearing about the success stories with Vex Robotics, whether that's a parent talking about how their student now is so much more engaged in school as a result of Vex, or a student talking about how much they love engineering now, how much they love computer science.",468.536,484.018,0,JM
8,69,69,"If you have any of those success stories, whether it's about competitions, classrooms, or both, we would love to hear that.","If you have any of those success stories, whether it's about competitions, classrooms, or both, we would love to hear that.",484.114,491.306,0,JM
8,70,70,So please share that with us.,So please share that with us.,491.328,493.18,0,JM
8,71,71,I just hope in the future to have more success stories.,I just hope in the future to have more success stories.,495.31,498.47,1,Dallas Librarian
8,72,72,I can only say that I appreciate your product and my learning curve has been enormous this year by being thrown into the classroom to teach this and just want to continue to grow as a librarian and learn even more about coding and robotics in the future for the benefit of my students.,I can only say that I appreciate your product and my learning curve has been enormous this year by being thrown into the classroom to teach this and just want to continue to grow as a librarian and learn even more about coding and robotics in the future for the benefit of my students.,498.55,528.84,1,Dallas Librarian
8,73,73,One more time.,One more time.,532.41,533.72,0,JM
8,74,74,"Okay, this is one of my favorite questions to ask educators.","Okay, this is one of my favorite questions to ask educators.",534.49,537.538,0,JM
8,75,75,"And again, please be honest, don't be shy.","And again, please be honest, don't be shy.",537.554,540.306,0,JM
8,76,76,Tell me about that one lesson with sex that went terrible.,Tell me about that one lesson with sex that went terrible.,540.418,543.926,0,JM
8,77,77,Tell me about that one lesson.,Tell me about that one lesson.,544.038,545.414,0,JM
8,78,78,"You couldn't wait to walk into school and teach this particular lesson, and it just went bad.","You couldn't wait to walk into school and teach this particular lesson, and it just went bad.",545.462,550.202,0,JM
8,79,79,It fell flat.,It fell flat.,550.256,551.094,0,JM
8,80,80,It didn't work out for whatever reason.,It didn't work out for whatever reason.,551.142,552.602,0,JM
8,81,81,We would love to know why so that we can fix that particular lesson.,We would love to know why so that we can fix that particular lesson.,552.656,556.682,0,JM
8,82,82,"Now, as a corollary to that, you can either include this or as an or let us know about that one student or that group of students that you were not able to reach with Vex.","Now, as a corollary to that, you can either include this or as an or let us know about that one student or that group of students that you were not able to reach with Vex.",556.746,568.894,0,JM
8,83,83,"You thought that after the exposure to your robotics club or to your classroom with Vex that these students would want to go on and pursue engineering careers or computer science or just really kind of be engaged with it, but for whatever reason, it didn't work out.","You thought that after the exposure to your robotics club or to your classroom with Vex that these students would want to go on and pursue engineering careers or computer science or just really kind of be engaged with it, but for whatever reason, it didn't work out.",568.942,583.126,0,JM
8,84,84,We would love to hear that.,We would love to hear that.,583.228,584.76,0,JM
8,85,85,I guess the struggles that we had with Beck's IQ are some of the same ones that a lot of the kids or some of the presenters had shared where the controller was not connected to the brain.,I guess the struggles that we had with Beck's IQ are some of the same ones that a lot of the kids or some of the presenters had shared where the controller was not connected to the brain.,585.93,602.67,1,Dallas Librarian
8,86,86,"Or for instance, I did a March Madness activity.","Or for instance, I did a March Madness activity.",603.41,608.81,1,Dallas Librarian
8,87,87,"So they built a couple of basketball nets at other end, and then they had to code the robot to go throw the ball in there.","So they built a couple of basketball nets at other end, and then they had to code the robot to go throw the ball in there.",608.89,621.346,1,Dallas Librarian
8,88,88,"And each time they were asking it to drive forward, even though they would change the code to drive straight, make a 90 degree angle.","And each time they were asking it to drive forward, even though they would change the code to drive straight, make a 90 degree angle.",621.448,639.606,1,Dallas Librarian
8,89,89,Each time it went differently.,Each time it went differently.,639.798,643.69,1,Dallas Librarian
8,90,90,"I don't know, for lack of a better word, it just didn't seem like it was the same every time.","I don't know, for lack of a better word, it just didn't seem like it was the same every time.",646.11,652.43,1,Dallas Librarian
8,91,91,And so they got frustrated by that.,And so they got frustrated by that.,652.5,656.27,1,Dallas Librarian
8,92,92,But I'm not sure that there's anything you can do with that.,But I'm not sure that there's anything you can do with that.,656.34,659.262,1,Dallas Librarian
8,93,93,"So frustration is definitely part of it, but it's also a growing and learning lesson.","So frustration is definitely part of it, but it's also a growing and learning lesson.",659.316,667.77,1,Dallas Librarian
8,94,94,"And to be in the future, they will have to learn how to deal with failure.","And to be in the future, they will have to learn how to deal with failure.",667.93,675.602,1,Dallas Librarian
8,95,95,"Failure and frustration, both myself and the students.","Failure and frustration, both myself and the students.",675.666,679.35,1,Dallas Librarian
8,96,96,And then what can we do to make it better?,And then what can we do to make it better?,679.5,682.774,1,Dallas Librarian
8,97,97,How can we fix that problem?,How can we fix that problem?,682.892,684.438,1,Dallas Librarian
8,98,98,That would be the challenge.,That would be the challenge.,684.524,686.15,1,Dallas Librarian
8,99,99,Great.,Great.,689.05,689.846,0,JM
8,100,100,Thank you so much.,Thank you so much.,690.028,691.078,0,JM
8,101,101,You're welcome.,You're welcome.,691.164,692.214,1,Dallas Librarian
8,102,102,Really?,Really?,692.412,692.66,1,Dallas Librarian
9,0,0,Of information about yourself.,Of information about yourself.,0.17,1.76,0,JM
9,1,1,Okay.,Okay.,4.21,4.622,0,JM
9,2,2,My name is Jeff Long.,My name is Jeff Long.,4.676,5.822,1,Jeff Long
9,3,3,"I teach at Stevenson Middle School down in San Antonio, Texas.","I teach at Stevenson Middle School down in San Antonio, Texas.",5.876,8.938,1,Jeff Long
9,4,4,I've been teaching for five years.,I've been teaching for five years.,9.034,10.59,1,Jeff Long
9,5,5,"Prior to that, I was 24 years in the military as an army engineer.","Prior to that, I was 24 years in the military as an army engineer.",10.66,13.946,1,Jeff Long
9,6,6,"Right now, I teach Stem and Engineering.","Right now, I teach Stem and Engineering.",14.138,16.106,1,Jeff Long
9,7,7,"So I have a stem future lab course, and then I have a applied engineering course.","So I have a stem future lab course, and then I have a applied engineering course.",16.138,20.782,1,Jeff Long
9,8,8,That's where we teach the the Vex IQ.,That's where we teach the the Vex IQ.,20.836,23.15,1,Jeff Long
9,9,9,"Right now, we're doing Vex IQ you for about three weeks.","Right now, we're doing Vex IQ you for about three weeks.",23.49,26.422,1,Jeff Long
9,10,10,So we're just looking at how do we incorporate the stuff from PD into our learning management system?,So we're just looking at how do we incorporate the stuff from PD into our learning management system?,26.556,33.302,1,Jeff Long
9,11,11,And I am the only one in the district right now that's doing that.,And I am the only one in the district right now that's doing that.,33.436,37.014,1,Jeff Long
9,12,12,"So I'm taking the stuff from Vexpd and putting it into our LMS, which is schoology.","So I'm taking the stuff from Vexpd and putting it into our LMS, which is schoology.",37.052,42.15,1,Jeff Long
9,13,13,And we're starting off with kind of Introduction to Robotics.,And we're starting off with kind of Introduction to Robotics.,42.31,46.854,1,Jeff Long
9,14,14,Then we do Introduction to Coding.,Then we do Introduction to Coding.,46.902,48.598,1,Jeff Long
9,15,15,Then we go into the tractor pool.,Then we go into the tractor pool.,48.694,51.266,1,Jeff Long
9,16,16,Then we go into gear ratio.,Then we go into gear ratio.,51.398,53.162,1,Jeff Long
9,17,17,Then we go into the Tug of War.,Then we go into the Tug of War.,53.226,63.294,1,Jeff Long
9,18,18,"Then we do a forklift build, and then we do some forklift competition stuff with the kids.","Then we do a forklift build, and then we do some forklift competition stuff with the kids.",63.412,68.882,1,Jeff Long
9,19,19,"And so really like, the system a lot of information kind of information overload when we go into PD and just learned about the Vex VR stuff.","And so really like, the system a lot of information kind of information overload when we go into PD and just learned about the Vex VR stuff.",69.016,78.046,1,Jeff Long
9,20,20,So that's going to be interesting to try to incorporate.,So that's going to be interesting to try to incorporate.,78.088,80.466,1,Jeff Long
9,21,21,"And that's going to kind of assist us with rolling out the IQ to some of these other schools, because one of our big challenges, of course funding and then the number of kits that we have.","And that's going to kind of assist us with rolling out the IQ to some of these other schools, because one of our big challenges, of course funding and then the number of kits that we have.",80.578,91.962,1,Jeff Long
9,22,22,"So if you have anything over three students on a kit, they kind of lose interest a little bit, because really, it's like a two student kit.","So if you have anything over three students on a kit, they kind of lose interest a little bit, because really, it's like a two student kit.",92.016,101.37,1,Jeff Long
9,23,23,So just trying to get the kids keep the kid engaged while they're learning.,So just trying to get the kids keep the kid engaged while they're learning.,101.81,107.982,1,Jeff Long
9,24,24,The Vxvr is going to be really great on that.,The Vxvr is going to be really great on that.,108.036,110.48,1,Jeff Long
9,25,25,"All right, next question.","All right, next question.",113.49,114.718,0,JM
9,26,26,Thank you for information about yourself.,Thank you for information about yourself.,114.804,116.418,0,JM
9,27,27,Really appreciate that.,Really appreciate that.,116.504,117.874,0,JM
9,28,28,"What are your goals with Stem or computer science education, again?","What are your goals with Stem or computer science education, again?",117.992,122.082,0,JM
9,29,29,"If you're just getting started with Vex or you've been doing Vex for a while, you want to continue your program, you want to expand what you're doing with your program.","If you're just getting started with Vex or you've been doing Vex for a while, you want to continue your program, you want to expand what you're doing with your program.",122.216,129.854,0,JM
9,30,30,"Maybe you're in the classroom, and you want to go to competitions.","Maybe you're in the classroom, and you want to go to competitions.",129.992,132.434,0,JM
9,31,31,Maybe you're doing competitions.,Maybe you're doing competitions.,132.482,133.586,0,JM
9,32,32,You want to go back in the classroom.,You want to go back in the classroom.,133.618,135.058,0,JM
9,33,33,"Or maybe you're just thinking about implementing Stem, and you want to implement it.","Or maybe you're just thinking about implementing Stem, and you want to implement it.",135.154,138.934,0,JM
9,34,34,You want to implement Stem with Vex.,You want to implement Stem with Vex.,138.972,140.786,0,JM
9,35,35,Tell us what your goals are with Stem education.,Tell us what your goals are with Stem education.,140.898,143.98,0,JM
9,36,36,So our goals with Stem education is to kind of keep it on where we're at right now.,So our goals with Stem education is to kind of keep it on where we're at right now.,144.59,148.906,1,Jeff Long
9,37,37,So about three weeks for the Vex IQ.,So about three weeks for the Vex IQ.,148.928,152.01,1,Jeff Long
9,38,38,One of our other future goals is to try to get into the competitions.,One of our other future goals is to try to get into the competitions.,152.35,156.19,1,Jeff Long
9,39,39,"And so if we could do it with Vex IQ, that would be okay.","And so if we could do it with Vex IQ, that would be okay.",156.53,160.398,1,Jeff Long
9,40,40,"But I kind of want to go with the Vexr X or RQ, the more advanced system that the high schools have.","But I kind of want to go with the Vexr X or RQ, the more advanced system that the high schools have.",160.484,168.786,1,Jeff Long
9,41,41,"Just trying to figure out how we're going to do that, how we're going to get the district to buy into.","Just trying to figure out how we're going to do that, how we're going to get the district to buy into.",168.968,174.098,1,Jeff Long
9,42,42,That is going to be the challenge.,That is going to be the challenge.,174.184,175.97,1,Jeff Long
9,43,43,"Okay, great.","Okay, great.",178.15,178.93,0,JM
9,44,44,"Now that we know what your goals are with Stem education, tell us what you feel some of the impediments might be.","Now that we know what your goals are with Stem education, tell us what you feel some of the impediments might be.",179.0,184.742,0,JM
9,45,45,What is in the way of you achieving your goals in Stem education?,What is in the way of you achieving your goals in Stem education?,184.876,188.534,0,JM
9,46,46,Is it teacher training?,Is it teacher training?,188.652,190.358,0,JM
9,47,47,Do you need more professional development?,Do you need more professional development?,190.444,192.486,0,JM
9,48,48,"Do you need to learn more about something like Python coding, or you want to be better at engineering?","Do you need to learn more about something like Python coding, or you want to be better at engineering?",192.518,197.702,0,JM
9,49,49,"What is it that you feel if you learned or you did or you receive professional development on, or if we create a resource for you could really take what you are doing to the next level.","What is it that you feel if you learned or you did or you receive professional development on, or if we create a resource for you could really take what you are doing to the next level.",197.846,208.56,0,JM
9,50,50,So I think one of the biggest issues is kind of the funding.,So I think one of the biggest issues is kind of the funding.,209.09,212.122,1,Jeff Long
9,51,51,"So just the number of kits that we have per student, like I had said before, another issue is how do you incorporate that transition from block coding to Python?","So just the number of kits that we have per student, like I had said before, another issue is how do you incorporate that transition from block coding to Python?",212.186,220.814,1,Jeff Long
9,52,52,"I find that especially at the level that we're at, middle school level, 8th graders, they have a lot of trouble kind of going from block coding to Python.","I find that especially at the level that we're at, middle school level, 8th graders, they have a lot of trouble kind of going from block coding to Python.",220.862,230.95,1,Jeff Long
9,53,53,And so I like the integration that you guys are doing with being able to do block coding first and then transitioning over to Python.,And so I like the integration that you guys are doing with being able to do block coding first and then transitioning over to Python.,231.93,239.506,1,Jeff Long
9,54,54,But it's just a challenge to get the kids to learn how to implement the Python without losing interest.,But it's just a challenge to get the kids to learn how to implement the Python without losing interest.,239.538,248.46,1,Jeff Long
9,55,55,Okay.,Okay.,250.75,251.21,0,JM
9,56,56,This question is kind of related to the question I just asked.,This question is kind of related to the question I just asked.,251.28,254.302,0,JM
9,57,57,"If you could change one thing about either Vex or your Stem implementation, what would make your life easier as an educator, what could we provide for you that could really make what you're doing with Stem a lot easier than what you are currently doing right now?","If you could change one thing about either Vex or your Stem implementation, what would make your life easier as an educator, what could we provide for you that could really make what you're doing with Stem a lot easier than what you are currently doing right now?",254.436,270.962,0,JM
9,58,58,"Let us know that, please.","Let us know that, please.",271.096,272.482,0,JM
9,59,59,And we would love to be able to provide that for you.,And we would love to be able to provide that for you.,272.536,274.9,0,JM
9,60,60,So I think the biggest thing would be how to implement it in an LMS.,So I think the biggest thing would be how to implement it in an LMS.,275.51,279.394,1,Jeff Long
9,61,61,So kind of this is what three week program would look like.,So kind of this is what three week program would look like.,279.522,284.214,1,Jeff Long
9,62,62,This is what a six week program this is what a nine week program would look like.,This is what a six week program this is what a nine week program would look like.,284.252,288.09,1,Jeff Long
9,63,63,"And just kind of giving the goals and we use Teaks, but the requirements per area.","And just kind of giving the goals and we use Teaks, but the requirements per area.",288.16,299.18,1,Jeff Long
9,64,64,"And just saying this is like a basic Stem course, or this is a basic Vex course.","And just saying this is like a basic Stem course, or this is a basic Vex course.",300.03,305.87,1,Jeff Long
9,65,65,"This is kind of more advanced and kind of outlining a little bit more, because right now, the problem with Vex PD that I have is it's a lot of information and just how to digest that information and then streamline it to what would fit our program.","This is kind of more advanced and kind of outlining a little bit more, because right now, the problem with Vex PD that I have is it's a lot of information and just how to digest that information and then streamline it to what would fit our program.",305.94,321.86,1,Jeff Long
9,66,66,"All right, thank you for information.","All right, thank you for information.",323.75,325.298,0,JM
9,67,67,That's wonderful.,That's wonderful.,325.384,326.286,0,JM
9,68,68,Is there anything else that you want to share with us?,Is there anything else that you want to share with us?,326.398,329.334,0,JM
