one,two,index,text,raw_text,start_time,end_time,speaker_id,speaker_name
13,23,23,"They're not necessarily competing in those competitions, but they're working around with all that same stuff they're doing all the setup, all the tear down, interacting with the teams, interacting with our key volunteers like our head reps and our judge advisors.","They're not necessarily competing in those competitions, but they're working around with all that same stuff they're doing all the setup, all the tear down, interacting with the teams, interacting with our key volunteers like our head reps and our judge advisors.",398.006,410.218,0,Jacob Roberts
13,24,24,And so being able to kind of watch them grow.,And so being able to kind of watch them grow.,410.314,413.12,0,Jacob Roberts
13,25,25,Similar stories to what I've heard at the conference so far this year.,Similar stories to what I've heard at the conference so far this year.,413.49,417.36,0,Jacob Roberts
13,26,26,Some of those stories of coming out and finding your position within a team and all that.,Some of those stories of coming out and finding your position within a team and all that.,418.05,423.934,0,Jacob Roberts
13,27,27,So that's been really cool perspective for me.,So that's been really cool perspective for me.,423.972,427.4,0,Jacob Roberts
13,28,28,"Yeah, in my position, I'm not working too closely in that one on one space.","Yeah, in my position, I'm not working too closely in that one on one space.",480.41,485.67,0,Jacob Roberts
13,29,29,"But I've done a few of our professional developments for our teachers in the district, getting them ready to coach new teams and be ready to build their program on their end.","But I've done a few of our professional developments for our teachers in the district, getting them ready to coach new teams and be ready to build their program on their end.",485.74,495.946,0,Jacob Roberts
13,30,30,"And so some of those frustrating pieces of not being able to get them to be able to build their own robot in a timely manner and be ready for our kind of end of day competition that we're doing during those PDS, we get those teachers in the room.","And so some of those frustrating pieces of not being able to get them to be able to build their own robot in a timely manner and be ready for our kind of end of day competition that we're doing during those PDS, we get those teachers in the room.",496.048,511.422,0,Jacob Roberts
13,31,31,I run the PD as a team.,I run the PD as a team.,511.476,514.334,0,Jacob Roberts
13,32,32,"I'm the coach and the mentor, and they're all the students building robots.","I'm the coach and the mentor, and they're all the students building robots.",514.452,517.886,0,Jacob Roberts
13,33,33,"And so getting them to that point where they can have a functioning moving robot at the end of the day, that's one of those funny, little missed parts of that education.","And so getting them to that point where they can have a functioning moving robot at the end of the day, that's one of those funny, little missed parts of that education.",517.998,529.96,0,Jacob Roberts
13,34,34,It.,It.,549.89,550.64,1,
13,35,35,Gives me enough.,Gives me enough.,553.57,554.14,0,Jacob Roberts
14,0,0,"So this is our first year running Vex over at our school in Los Angeles, California.","So this is our first year running Vex over at our school in Los Angeles, California.",0.97,6.41,0,Bernie Contreras
14,1,1,"And what we want to do, or what we hope to do, is to incorporate robotics throughout the core subjects.","And what we want to do, or what we hope to do, is to incorporate robotics throughout the core subjects.",6.57,14.618,0,Bernie Contreras
14,2,2,So not necessarily looking to expand more buy in throughout the campus.,So not necessarily looking to expand more buy in throughout the campus.,14.714,21.498,0,Bernie Contreras
14,3,3,I currently teach fifth grade.,I currently teach fifth grade.,21.674,23.93,0,Bernie Contreras
14,4,4,One of the other teacher that's doing it is also an upper grade teacher.,One of the other teacher that's doing it is also an upper grade teacher.,24.09,27.666,0,Bernie Contreras
14,5,5,We just got in one of the lower grade teachers this year.,We just got in one of the lower grade teachers this year.,27.698,30.47,0,Bernie Contreras
14,6,6,So we're just trying to get buy in throughout the school to support our robotics.,So we're just trying to get buy in throughout the school to support our robotics.,30.54,36.61,0,Bernie Contreras
14,7,7,"We're using the Vex IQ and the Vex Go, and the Vex one, two, three with the lower grades, but we're using it.","We're using the Vex IQ and the Vex Go, and the Vex one, two, three with the lower grades, but we're using it.",36.77,43.802,0,Bernie Contreras
14,8,8,"But we're trying to get buy in so that other teachers use it as part of their daily curriculum to truly meet the needs of not only our students, but also the title of Stem or Steam School that we have.","But we're trying to get buy in so that other teachers use it as part of their daily curriculum to truly meet the needs of not only our students, but also the title of Stem or Steam School that we have.",43.856,56.72,0,Bernie Contreras
14,9,9,Keep going.,Keep going.,57.33,58.32,1,
14,10,10,"Say your name and district or school, if you don't mind.","Say your name and district or school, if you don't mind.",58.93,62.158,1,
14,11,11,Okay.,Okay.,62.244,62.542,0,Bernie Contreras
14,12,12,"I am Bernie Contreras, fifth grade teacher over at Montague Charter Academy in Bokoima, California.","I am Bernie Contreras, fifth grade teacher over at Montague Charter Academy in Bokoima, California.",62.596,68.27,0,Bernie Contreras
14,13,13,"I think one of the primary things that I'm looking for with coming out, we don't have a team representing us in World.","I think one of the primary things that I'm looking for with coming out, we don't have a team representing us in World.",105.01,114.862,0,Bernie Contreras
14,14,14,"We made it as far as State, but the reason why we came out is, again, to get teacher buy in.","We made it as far as State, but the reason why we came out is, again, to get teacher buy in.",114.916,120.306,0,Bernie Contreras
14,15,15,"So definitely looking for strategies to be able to present this in a way that is not only beneficial to the students and helps to create a rigorous curriculum, but also something that is reasonably attainable for teachers to be able to do, given the nature of the faculty.","So definitely looking for strategies to be able to present this in a way that is not only beneficial to the students and helps to create a rigorous curriculum, but also something that is reasonably attainable for teachers to be able to do, given the nature of the faculty.",120.328,143.334,0,Bernie Contreras
14,16,16,"Over at our school, we have a lot of older teachers that are used to the traditional format with teaching, with directed instruction, teacher led instruction where they're teaching from the board.","Over at our school, we have a lot of older teachers that are used to the traditional format with teaching, with directed instruction, teacher led instruction where they're teaching from the board.",143.382,154.622,0,Bernie Contreras
14,17,17,"And so to incorporate technology, I'm trying to find very simple ways to be able to display it, which I've seen so far today.","And so to incorporate technology, I'm trying to find very simple ways to be able to display it, which I've seen so far today.",154.756,164.042,0,Bernie Contreras
14,18,18,"So that's what we're really hoping for today, finding ways where I can present this to burst my grade level and then to be able to go beyond that and show that with the examples that we're showing with Vex.","So that's what we're really hoping for today, finding ways where I can present this to burst my grade level and then to be able to go beyond that and show that with the examples that we're showing with Vex.",164.116,179.042,0,Bernie Contreras
14,19,19,"One, two, three.","One, two, three.",179.186,180.182,0,Bernie Contreras
14,20,20,I think those hit it right on.,I think those hit it right on.,180.316,182.134,0,Bernie Contreras
14,21,21,"That's more what I'm looking for, some sort of development.","That's more what I'm looking for, some sort of development.",182.172,185.67,0,Bernie Contreras
14,22,22,"If I understood the question correctly, I think that the program is sufficient for me right now.","If I understood the question correctly, I think that the program is sufficient for me right now.",214.31,219.234,0,Bernie Contreras
14,23,23,I would say that I'm very just getting myself oriented with the program.,I would say that I'm very just getting myself oriented with the program.,219.272,225.38,0,Bernie Contreras
14,24,24,This is our first year having it.,This is our first year having it.,225.75,227.278,0,Bernie Contreras
14,25,25,"I did see it last year, but we didn't really use it with the students.","I did see it last year, but we didn't really use it with the students.",227.304,231.814,0,Bernie Contreras
14,26,26,"But I think what would make it easier for me, really, is just more experience with it at the moment.","But I think what would make it easier for me, really, is just more experience with it at the moment.",232.012,238.774,0,Bernie Contreras
14,27,27,"Beyond that, I don't have any really good constructive feedback to be able to give on that at the moment.","Beyond that, I don't have any really good constructive feedback to be able to give on that at the moment.",238.892,245.96,0,Bernie Contreras
14,28,28,Okay.,Okay.,288.27,288.682,0,Bernie Contreras
14,29,29,I think one of the things that I really enjoyed about today's seminar so far has been how they presented how vex was able to be utilized as a resource for our special ed population.,I think one of the things that I really enjoyed about today's seminar so far has been how they presented how vex was able to be utilized as a resource for our special ed population.,288.736,303.71,0,Bernie Contreras
14,30,30,"I think if I could see how we could implement this, because I also am working with the gifted program at my school.","I think if I could see how we could implement this, because I also am working with the gifted program at my school.",304.29,311.694,0,Bernie Contreras
14,31,31,How can we implement this with the gifted?,How can we implement this with the gifted?,311.732,313.626,0,Bernie Contreras
14,32,32,How can we implement this with our English language learners?,How can we implement this with our English language learners?,313.658,316.478,0,Bernie Contreras
14,33,33,How could we implement this across curriculums?,How could we implement this across curriculums?,316.574,318.878,0,Bernie Contreras
14,34,34,"I did hear talk about Vex being a tool that teachers can use to go across the curriculum, to be able to include multiple subjects.","I did hear talk about Vex being a tool that teachers can use to go across the curriculum, to be able to include multiple subjects.",318.894,329.658,0,Bernie Contreras
14,35,35,"But if we could see more of that, I think that would be good.","But if we could see more of that, I think that would be good.",329.694,333.798,0,Bernie Contreras
14,36,36,"I did take a lot of notes, and it did generate a lot of ideas, but I'm hoping to see more of that again, since I'm hoping to take back what I learned here, to be able to develop professional developments or really just to display how beneficial this program is for the demographics of my school.","I did take a lot of notes, and it did generate a lot of ideas, but I'm hoping to see more of that again, since I'm hoping to take back what I learned here, to be able to develop professional developments or really just to display how beneficial this program is for the demographics of my school.",333.884,355.406,0,Bernie Contreras
14,37,37,I would love to see more of that's.,I would love to see more of that's.,355.508,362.35,0,Bernie Contreras
14,38,38,My sincere I didn't catch that question.,My sincere I didn't catch that question.,398.97,401.68,0,Bernie Contreras
14,39,39,I'm rewinding it right now to hear it again.,I'm rewinding it right now to hear it again.,405.25,407.6,0,Bernie Contreras
14,40,40,"Well, if I can share the story, I couldn't necessarily pinpoint one story that maybe you guys haven't heard already or doesn't fit the paradigm right?","Well, if I can share the story, I couldn't necessarily pinpoint one story that maybe you guys haven't heard already or doesn't fit the paradigm right?",436.25,446.73,0,Bernie Contreras
14,41,41,Because we've had all of those stories.,Because we've had all of those stories.,446.8,448.73,0,Bernie Contreras
14,42,42,The narrative of student disengage introduce Vex.,The narrative of student disengage introduce Vex.,449.31,453.706,0,Bernie Contreras
14,43,43,"But I think one of the biggest highlights for me, so that the community that I service, the neighborhood that our school is in, is the same neighborhood that I grew up and was raised in.","But I think one of the biggest highlights for me, so that the community that I service, the neighborhood that our school is in, is the same neighborhood that I grew up and was raised in.",453.898,467.202,0,Bernie Contreras
14,44,44,"And students primarily are focused on athletics, on finding success in entertainment.","And students primarily are focused on athletics, on finding success in entertainment.",467.336,477.886,0,Bernie Contreras
14,45,45,"And so to hear my students, the kids in my neighborhood, the kids that have all of the pitfalls that neighborhoods similar to Paquima have to actually be considering robotics or engineering or anything within that field as a potential career to me is badass.","And so to hear my students, the kids in my neighborhood, the kids that have all of the pitfalls that neighborhoods similar to Paquima have to actually be considering robotics or engineering or anything within that field as a potential career to me is badass.",477.998,497.702,0,Bernie Contreras
14,46,46,"And I don't know if I'm allowed to cuss on this or not, but it makes me so happy to see that and to hear that.","And I don't know if I'm allowed to cuss on this or not, but it makes me so happy to see that and to hear that.",497.766,504.43,0,Bernie Contreras
14,47,47,"And when we made it to State, we were recognized by our local government for doing that.","And when we made it to State, we were recognized by our local government for doing that.",504.5,510.766,0,Bernie Contreras
14,48,48,"When I would see these news stories in the past, I guess because I couldn't relate to them, they weren't hitting home.","When I would see these news stories in the past, I guess because I couldn't relate to them, they weren't hitting home.",510.948,517.714,0,Bernie Contreras
14,49,49,This is amazing.,This is amazing.,517.832,518.754,0,Bernie Contreras
14,50,50,We've had some local celebrities because of their choice of going into entertainment or going into the field of athletics.,We've had some local celebrities because of their choice of going into entertainment or going into the field of athletics.,518.872,528.066,0,Bernie Contreras
14,51,51,"But this is so much more realistic, in my opinion.","But this is so much more realistic, in my opinion.",528.178,533.35,0,Bernie Contreras
14,52,52,I'm all about USC.,I'm all about USC.,533.85,535.186,0,Bernie Contreras
14,53,53,"I work also with USC, so I apologize if anybody hears a Bruin or UCLA, which is also a great school.","I work also with USC, so I apologize if anybody hears a Bruin or UCLA, which is also a great school.",535.218,541.818,0,Bernie Contreras
14,54,54,"But I tell my students there's a much greater chance if you were to pursue robotics, to be able to pursue a career in it.","But I tell my students there's a much greater chance if you were to pursue robotics, to be able to pursue a career in it.",541.904,549.594,0,Bernie Contreras
14,55,55,"I mean, the numbers are in their favor.","I mean, the numbers are in their favor.",549.632,552.27,0,Bernie Contreras
14,56,56,So to have a program like this to pull them in is almost similar to these clinics that these different organizations are running.,So to have a program like this to pull them in is almost similar to these clinics that these different organizations are running.,552.34,561.23,0,Bernie Contreras
14,57,57,"We have LAFC that runs a soccer clinic, and we've had the Clippers run clinics in our neighborhood.","We have LAFC that runs a soccer clinic, and we've had the Clippers run clinics in our neighborhood.",561.3,567.534,0,Bernie Contreras
14,58,58,"And so to have robotics run these programs and get kids interested, man, I could go on for days about this, but I also want to head out to lunch.","And so to have robotics run these programs and get kids interested, man, I could go on for days about this, but I also want to head out to lunch.",567.582,575.906,0,Bernie Contreras
14,59,59,I'm going to go on to the next question.,I'm going to go on to the next question.,575.938,577.32,0,Bernie Contreras
14,60,60,"All right, thank you, guys.","All right, thank you, guys.",608.05,609.294,0,Bernie Contreras
14,61,61,Have a blessed and beautiful one.,Have a blessed and beautiful one.,609.332,610.46,0,Bernie Contreras
15,0,0,You're using sex.,You're using sex.,0.17,1.034,0,JM
15,1,1,Which classroom are you using?,Which classroom are you using?,1.082,2.462,0,JM
15,2,2,"Best code or Best code, VR, whatever it is.","Best code or Best code, VR, whatever it is.",2.516,6.51,0,JM
15,3,3,"If you're not using Vex right now, just tell us what you're teaching, what grade levels you're teaching.","If you're not using Vex right now, just tell us what you're teaching, what grade levels you're teaching.",6.66,11.674,0,JM
15,4,4,"Tell us a little about how long you've been teaching, where you're teaching.","Tell us a little about how long you've been teaching, where you're teaching.",11.722,15.098,0,JM
15,5,5,Give us a little information about all.,Give us a little information about all.,15.194,18.798,0,JM
15,6,6,"Right, my name is Bridget Myers.","Right, my name is Bridget Myers.",18.804,20.49,1,Bridget Myers
15,7,7,I teach at Highland Park Middle School.,I teach at Highland Park Middle School.,20.57,22.462,1,Bridget Myers
15,8,8,"This is my 9th year teaching that I started off as a actually health teacher and coach, worked my way up to science, and now I'm teaching engineering and teaching graphic design.","This is my 9th year teaching that I started off as a actually health teacher and coach, worked my way up to science, and now I'm teaching engineering and teaching graphic design.",22.516,32.246,1,Bridget Myers
15,9,9,"So I've always had an interest in coding and robotics and building, and I love that I get to do that.","So I've always had an interest in coding and robotics and building, and I love that I get to do that.",32.348,37.382,1,Bridget Myers
15,10,10,Now.,Now.,37.436,38.04,1,Bridget Myers
15,11,11,We use the Vex IQ robots.,We use the Vex IQ robots.,38.49,40.754,1,Bridget Myers
15,12,12,It's our second year using them.,It's our second year using them.,40.802,42.074,1,Bridget Myers
15,13,13,"Our high school uses the Vex V five, and they have a robotics team and robotics classes, and they actually do compete.","Our high school uses the Vex V five, and they have a robotics team and robotics classes, and they actually do compete.",42.112,48.87,1,Bridget Myers
15,14,14,Our middle school does not yet compete.,Our middle school does not yet compete.,48.95,51.706,1,Bridget Myers
15,15,15,We just use robotics in the engineering classroom and have just been looking for ways to implement it into our other classes and really introduce it from where I use it in the 8th grade to our fifth and 6th graders that are on the other side of the building.,We just use robotics in the engineering classroom and have just been looking for ways to implement it into our other classes and really introduce it from where I use it in the 8th grade to our fifth and 6th graders that are on the other side of the building.,51.898,69.14,1,Bridget Myers
15,16,16,"All right, next question.","All right, next question.",71.67,72.898,0,JM
15,17,17,Thank you for information about yourself.,Thank you for information about yourself.,72.984,74.578,0,JM
15,18,18,Really appreciate that.,Really appreciate that.,74.664,76.002,0,JM
15,19,19,"What are your goals with Stem or computer science education, again?","What are your goals with Stem or computer science education, again?",76.136,80.182,0,JM
15,20,20,"If you're just getting started with vets, when you've been doing vets for a while, you want to continue your program.","If you're just getting started with vets, when you've been doing vets for a while, you want to continue your program.",80.316,85.75,0,JM
15,21,21,You want to expand what you do in your program.,You want to expand what you do in your program.,85.82,87.974,0,JM
15,22,22,Maybe you're in the classroom.,Maybe you're in the classroom.,88.092,89.282,0,JM
15,23,23,"You want to go to competitions, competitions.","You want to go to competitions, competitions.",89.346,91.746,0,JM
15,24,24,You want to go back in the classroom.,You want to go back in the classroom.,91.778,93.19,0,JM
15,25,25,Or maybe you're just thinking about implementing Stem and you want to implement Stem with that.,Or maybe you're just thinking about implementing Stem and you want to implement Stem with that.,93.27,98.906,0,JM
15,26,26,Tell us what your goals are with Stem education.,Tell us what your goals are with Stem education.,99.008,102.14,0,JM
15,27,27,I actually have a couple of goals with Stem education.,I actually have a couple of goals with Stem education.,103.31,105.854,1,Bridget Myers
15,28,28,So one of the first ones is going to be just getting more girls in the classroom.,So one of the first ones is going to be just getting more girls in the classroom.,105.972,111.37,1,Bridget Myers
15,29,29,So I have two engineering classes right now.,So I have two engineering classes right now.,111.45,113.906,1,Bridget Myers
15,30,30,They're the CTE classes.,They're the CTE classes.,113.928,115.81,1,Bridget Myers
15,31,31,"One is all boys, 22 boys, and the other one is six girls and 18 boys.","One is all boys, 22 boys, and the other one is six girls and 18 boys.",116.39,123.118,1,Bridget Myers
15,32,32,And so both do well in there.,And so both do well in there.,123.294,125.954,1,Bridget Myers
15,33,33,But I would love to see more equity in that.,But I would love to see more equity in that.,125.992,128.614,1,Bridget Myers
15,34,34,"Obviously, being a female teacher myself and just coming from an all girls high school where I can see just what women can do, that is one of my goals.","Obviously, being a female teacher myself and just coming from an all girls high school where I can see just what women can do, that is one of my goals.",128.732,139.254,1,Bridget Myers
15,35,35,Another one of my goals is getting robotics as a standalone electives class for our 7th graders and for our 8th graders.,Another one of my goals is getting robotics as a standalone electives class for our 7th graders and for our 8th graders.,139.382,146.918,1,Bridget Myers
15,36,36,"So having a class, having more scaffolding in our robotics program.","So having a class, having more scaffolding in our robotics program.",147.014,153.546,1,Bridget Myers
15,37,37,"So there is a high school credit, robotics one and two class that they can take at the high school.","So there is a high school credit, robotics one and two class that they can take at the high school.",153.648,158.062,1,Bridget Myers
15,38,38,"So really looking at how can we start adding this earlier and earlier, and how can we make sure that what they're doing is adding on and complementing without making the curriculum redundant?","So really looking at how can we start adding this earlier and earlier, and how can we make sure that what they're doing is adding on and complementing without making the curriculum redundant?",158.116,170.19,1,Bridget Myers
15,39,39,So I would like ultimately to make it district wide.,So I would like ultimately to make it district wide.,170.27,176.222,1,Bridget Myers
15,40,40,We have done that with our languages other than English.,We have done that with our languages other than English.,176.366,179.762,1,Bridget Myers
15,41,41,So now we have a K twelve Spanish program.,So now we have a K twelve Spanish program.,179.826,182.6,1,Bridget Myers
15,42,42,And so I know that the district is interested in doing that.,And so I know that the district is interested in doing that.,183.13,186.454,1,Bridget Myers
15,43,43,Obviously it's just about showing value.,Obviously it's just about showing value.,186.572,188.242,1,Bridget Myers
15,44,44,"So if I can start by making elective classes in 7th and 8th grade just for standalone for robotics or implementing them within another type of class, then we can really see that as a program that goes throughout the district.","So if I can start by making elective classes in 7th and 8th grade just for standalone for robotics or implementing them within another type of class, then we can really see that as a program that goes throughout the district.",188.316,205.946,1,Bridget Myers
15,45,45,The other one is just about another goal is just personally.,The other one is just about another goal is just personally.,206.058,209.674,1,Bridget Myers
15,46,46,"So obviously I'm newer to coding and robotics, although I know how to code and I have had some experience with building robots.","So obviously I'm newer to coding and robotics, although I know how to code and I have had some experience with building robots.",209.722,217.49,1,Bridget Myers
15,47,47,That's not what my training comes from.,That's not what my training comes from.,218.47,220.162,1,Bridget Myers
